question,answer,contexts,ground_truths,ground_truth,context_precision,context_recall,faithfulness,answer_relevancy
What restaurants are supplied by 'Hg Walter'?,"The restaurants supplied by 'Hg Walter' are Muse, Cafe Murano, River Café, Kricket, Andrew Edmunds, Company of Cooks, Petersham Nurseries, Bobo & Wild, and Notto.","['A Supplier named Hg Walter supplies British Meat in the location London to a Restaurant named Muse.'
 'A Supplier named Hg Walter supplies Meat in the location London to a Restaurant named Cafe Murano.'
 'A Supplier named Hg Walter supplies British Meat in the location London to a Restaurant named River Café.'
 'A Supplier named Hg Walter supplies Meat and Pantry Products in the location London to a Restaurant named Kricket.'
 'A Supplier named Hg Walter supplies Meat in the location London to a Restaurant named Andrew Edmunds.'
 'A Supplier named Hg Walter supplies Not Specified in the location Not Specified to a Restaurant named Company of Cooks.'
 'A Supplier named Hg Walter supplies British Meat in the location London to a Restaurant named Petersham Nurseries.'
 'A Supplier named Hg Walter supplies Meats in the location Not Specified to a Restaurant named Bobo & Wild.'
 'A Supplier named H G Walter supplies Meat in the location Uk to a Restaurant named Notto.'
 'A Supplier named Hg Walter supplies Butchers in the location London to a Restaurant named Andrew Edmunds.']","[""The restaurants supplied by 'Hg Walter' are Petersham Nurseries, River Café, Kricket, Elystan Street, Company of Cooks, Bobo & Wild, Tommi’s Burger Joint, Cafe Murano, Farang, Andrew Edmunds, and Muse.""]","The restaurants supplied by 'Hg Walter' are Petersham Nurseries, River Café, Kricket, Elystan Street, Company of Cooks, Bobo & Wild, Tommi’s Burger Joint, Cafe Murano, Farang, Andrew Edmunds, and Muse.",0.99999999999,1.0,1.0,0.9973187217707159
Who are the tier 2 suppliers of 'The Chiltern Firehouse'?,"The tier 2 suppliers of 'The Chiltern Firehouse' are Jun Chiyabari, Satemwa Tea & Coffee Estate, and Amba.","['A T2_Supplier named Jun Chiyabari supplies Tea in the location Dhankuta, Eastern Nepal to a Supplier named Rare Tea Company, this Supplier named Rare Tea Company then supplies Tea in the location Not Specified to a Restaurant named The Chiltern Firehouse.'
 'A Supplier named Rare Tea Company supplies Tea in the location Not Specified to a Restaurant named The Chiltern Firehouse.'
 'A T2_Supplier named Satemwa Tea & Coffee Estate supplies Tea in the location Shire Highlands, Thyolo Mountains, Malawi to a Supplier named Rare Tea Company, this Supplier named Rare Tea Company then supplies Tea in the location Not Specified to a Restaurant named The Chiltern Firehouse.'
 'A T2_Supplier named Amba supplies Handcrafted Black Teas, Lemongrass, Butalso Fruits & Vegetables, Spices, Honey and Homemade Jams in the location Uva Highlands, Sri Lanka to a Supplier named Rare Tea Company, this Supplier named Rare Tea Company then supplies Tea in the location Not Specified to a Restaurant named The Chiltern Firehouse.'
 'A Supplier named Hg Walter supplies British Meat in the location London to a Restaurant named River Café.'
 'A Supplier named Cobble Lane Cured supplies High-end British Charcuterie in the location London to a Restaurant named Company of Cooks.'
 'A T2_Supplier named The Food Heroes Family supplies Various Products in the location Not Specified to a Supplier named Wellocks at Home, this Supplier named Wellocks at Home then supplies Larder Ingredients in the location Yorkshire to a Restaurant named Notto.'
 'A Supplier named Hg Walter supplies Meat and Pantry Products in the location London to a Restaurant named Kricket.'
 'A T2_Supplier named Barfoots supplies Green Beans, Tenderstem Broccoli, Sweetcorn, Chillies in the location Uk to a Supplier named Fresh Direct.'
 'A T2_Supplier named The Food Heroes Family supplies Various Products in the location Not Specified to a Supplier named Wellocks at Home.']","[""The tier 2 suppliers of 'The Chiltern Firehouse' are Jun Chiyabari, Satemwa Tea & Coffee Estate, and Amba.""]","The tier 2 suppliers of 'The Chiltern Firehouse' are Jun Chiyabari, Satemwa Tea & Coffee Estate, and Amba.",0.0,1.0,1.0,1.0
What is the entire supply chain for the restaurant 'Notto'?,"The entire supply chain for the restaurant 'Notto' consists of several suppliers. H G Walter supplies meat from the UK, Cibo provides 00 Flour, Burrata, and other Italian ingredients, location not specified. Wellocks at Home, based in Yorkshire, supplies larder ingredients, and it receives sushi ingredients from its T2_Supplier, Sushisushi, as well as unspecified supplies from La Rose Noire, another T2_Supplier. The Wild Room supplies wild mushrooms and foraged produce, location not specified.","['A Supplier named H G Walter supplies Meat in the location Uk to a Restaurant named Notto.'
 'A Supplier named Cibo supplies 00 Flour, Burrata and Other Italian Ingredients in the location Not Specified to a Restaurant named Notto.'
 'A Supplier named Wellocks at Home supplies Larder Ingredients in the location Yorkshire to a Restaurant named Notto.'
 'A Supplier named The Wild Room supplies Wild Mushrooms and Foraged Produce in the location Not Specified to a Restaurant named Notto.'
 'A Supplier named Natoora supplies Produce in the location Not Specified to a Restaurant named Warehouse.'
 'A T2_Supplier named Sushisushi supplies Sushi Ingredients in the location Not Specified to a Supplier named Wellocks at Home, this Supplier named Wellocks at Home then supplies Larder Ingredients in the location Yorkshire to a Restaurant named Notto.'
 'A Supplier named Natoora supplies Seasonal Produce in the location Uk to a Restaurant named Cafe Murano.'
 'A Supplier named Afropol supplies Fine Food Products in the location Not Specified to a Restaurant named Ottolenghi Group.'
 'A T2_Supplier named La Rose Noire supplies Not Specified in the location Not Specified to a Supplier named Wellocks at Home, this Supplier named Wellocks at Home then supplies Larder Ingredients in the location Yorkshire to a Restaurant named Notto.'
 'A Supplier named Afropol supplies Fine Food Products in the location Not Specified to a Restaurant named Bocca Di Lupo.']","[""The restaurant 'Notto' has its supply chain primarily from one Tier 1 supplier, 'Wellocks at Home'. The Tier 2 suppliers, who supply to 'Wellocks at Home', include 'Amela Tomatoes', 'Belazu', 'Blackthorn Salt', 'Eduardo Sousa', 'La Rose Noire', 'Minus 8 Vinegar', 'Manjares Truffles', 'Molyneux Kale Company', 'Spilmans Asparagus', 'Sushisushi', 'Seddon Leeks', 'The Food Heroes Family', 'Tomlinson Farm Shop', 'Truefoods', 'Westlands', 'Wildfarmed', and 'Wild Greens Farm'.""]","The restaurant 'Notto' has its supply chain primarily from one Tier 1 supplier, 'Wellocks at Home'. The Tier 2 suppliers, who supply to 'Wellocks at Home', include 'Amela Tomatoes', 'Belazu', 'Blackthorn Salt', 'Eduardo Sousa', 'La Rose Noire', 'Minus 8 Vinegar', 'Manjares Truffles', 'Molyneux Kale Company', 'Spilmans Asparagus', 'Sushisushi', 'Seddon Leeks', 'The Food Heroes Family', 'Tomlinson Farm Shop', 'Truefoods', 'Westlands', 'Wildfarmed', and 'Wild Greens Farm'.",0.99999999999,0.5,1.0,0.9663607045292437
What are some common suppliers of 'Meat'?,"Some common suppliers of 'Meat' include The Rare Breed Meat Company, Swaledale Butchers, Lake District Farmers, Aubrey Allen, Hg Walter, and The Ethical Butcher.","['A Supplier named The Rare Breed Meat Company supplies Meat and Game in the location London to a Restaurant named Trinity.'
 'A Supplier named The Rare Breed Meat Company supplies Meat and Game in the location London to a Restaurant named The Hawksmoor.'
 'A Supplier named Swaledale Butchers supplies Rare-breed Meats in the location Yorkshire to a Restaurant named Som Saa.'
 'A Supplier named The Rare Breed Meat Company supplies Meat and Game in the location London to a Restaurant named The Ned.'
 'A Supplier named Lake District Farmers supplies Meat in the location Lake District to a Restaurant named Moor Hall.'
 'A Supplier named Aubrey Allen supplies Meat in the location Uk to a Restaurant named The Black Swan.'
 'A Supplier named Hg Walter supplies Meat and Pantry Products in the location London to a Restaurant named Kricket.'
 'A Supplier named The Ethical Butcher supplies Regeneratively Produced Meats in the location Not Specified to a Restaurant named Apricity.'
 'A Supplier named Swaledale Butchers supplies Rare-breed Meats in the location Yorkshire to a Restaurant named The Good Egg.'
 'A Supplier named Hg Walter supplies British Meat in the location London to a Restaurant named Muse.']","[""Some common suppliers of 'Meat' are Aubrey Allen, H G Walter, and Lake District Farmers.""]","Some common suppliers of 'Meat' are Aubrey Allen, H G Walter, and Lake District Farmers.",0.5657142857029713,0.5,0.6666666666666666,1.000000000000001
Which suppliers of 'Meat' are based in 'London'?,The suppliers of 'Meat' based in 'London' are 'The Rare Breed Meat Company' and 'Hg Walter'.,"['A Supplier named The Rare Breed Meat Company supplies Meat and Game in the location London to a Restaurant named Trinity.'
 'A Supplier named The Rare Breed Meat Company supplies Meat and Game in the location London to a Restaurant named The Ned.'
 'A Supplier named The Rare Breed Meat Company supplies Meat and Game in the location London to a Restaurant named The Hawksmoor.'
 'A Supplier named Hg Walter supplies British Meat in the location London to a Restaurant named Muse.'
 'A Supplier named Hg Walter supplies British Meat in the location London to a Restaurant named Petersham Nurseries.'
 'A Supplier named Hg Walter supplies British Meat in the location London to a Restaurant named River Café.'
 'A Supplier named Hg Walter supplies Meat in the location London to a Restaurant named Andrew Edmunds.'
 'A Supplier named Hg Walter supplies Meat and Pantry Products in the location London to a Restaurant named Kricket.'
 'A Supplier named Hg Walter supplies Meat in the location London to a Restaurant named Farang.'
 'A Supplier named Hg Walter supplies Meat in the location London to a Restaurant named Cafe Murano.']","[""The supplier of 'Meat' based in 'London' is 'Hg Walter'.""]",The supplier of 'Meat' based in 'London' is 'Hg Walter'.,0.5304421768631705,1.0,1.0,0.9750646541601918
