question,answer,contexts,ground_truth,context_precision,context_recall,faithfulness,answer_relevancy
What restaurants are supplied by 'Hg Walter'?,"{'Tier 1 Suppliers': 'Wellocks at Home, Fresh Direct, The Seahorse, Hg Walter', 'Tier 2 Suppliers': {'Wellocks at Home': 'Truefoods, Wildfarmed, Eduardo Sousa, Westlands, Seddon Leeks, Belazu, The Food Heroes Family, Molyneux Kale Company, Blackthorn Salt, La Rose Noire', 'Fresh Direct': 'Hammond Produce, Agrosol, De Groot, Sun Salads, Chiquita, Driscolls, Barfoots, Len Wrights', 'The Seahorse': 'Brixham Seafish', 'Hg Walter': 'The provided information does not specify any T2_Suppliers directly supplying Hg Walter.'}}","['A T2_Supplier named Eduardo Sousa supplies Not Specified in the location Not Specified to a Supplier named Wellocks at Home.'
 'A T2_Supplier named Agrosol supplies Various Fruits and Vegetables in the location Almería, Spain to a Supplier named Fresh Direct.'
 'A T2_Supplier named Belazu supplies Various Products in the location Not Specified to a Supplier named Wellocks at Home.'
 'A T2_Supplier named Belazu supplies Various Products in the location Not Specified to a Supplier named Wellocks at Home, this Supplier named Wellocks at Home then supplies Next Day Groceries in the location Not Specified to a Restaurant named Moor Hall.'
 'A T2_Supplier named Hammond Produce supplies Various Vegetables in the location Uk to a Supplier named Fresh Direct.'
 'A T2_Supplier named Spilmans Asparagus supplies Asparagus in the location Not Specified to a Supplier named Wellocks at Home.'
 'A T2_Supplier named The Food Heroes Family supplies Various Products in the location Not Specified to a Supplier named Wellocks at Home.'
 'A T2_Supplier named Driscolls supplies Berries, Cherries, and Plums in the location Uk to a Supplier named Fresh Direct.'
 'A T2_Supplier named Brixham Seafish supplies Fish in the location Brixham to a Supplier named The Seahorse.'
 'A Supplier named Hg Walter supplies Meat and Pantry Products in the location London to a Restaurant named Kricket.'
 'A Supplier named Hg Walter supplies Not Specified in the location Not Specified to a Restaurant named Company of Cooks.'
 'A Supplier named Hg Walter supplies British Meat in the location London to a Restaurant named Petersham Nurseries.'
 'A Supplier named Hg Walter supplies Meat and Pantry Products in the location London to a Restaurant named Kricket.'
 'A Supplier named Hg Walter supplies Meat in the location London to a Restaurant named Andrew Edmunds.'
 'A Supplier named Hg Walter supplies Butchers in the location London to a Restaurant named Andrew Edmunds.'
 'A Supplier named Hg Walter supplies British Meat in the location London to a Restaurant named River Café.'
 'A Supplier named Hg Walter supplies Meat in the location London to a Restaurant named Cafe Murano.'
 'A Supplier named Hg Walter supplies Meat in the location London to a Restaurant named Farang.'
 'A Supplier named Hg Walter supplies British Meat in the location London to a Restaurant named Muse.'
 'A T2_Supplier named Eduardo Sousa supplies Not Specified in the location Not Specified to a Supplier named Wellocks at Home.']","[""The restaurants supplied by 'Hg Walter' are Petersham Nurseries, River Café, Kricket, Elystan Street, Company of Cooks, Bobo & Wild, Tommi’s Burger Joint, Cafe Murano, Farang, Andrew Edmunds, and Muse.""]",0.5803991020363761,0.0,0.5,0.8782245477359419
Who are the tier 2 suppliers of 'The Chiltern Firehouse'?,"{'Rare Tea Company': 'Jun Chiyabari, Satemwa Tea & Coffee Estate'}","['A Supplier named Rare Tea Company supplies Tea in the location Not Specified to a Restaurant named The Chiltern Firehouse.'
 'A T2_Supplier named Jun Chiyabari supplies Tea in the location Dhankuta, Eastern Nepal to a Supplier named Rare Tea Company, this Supplier named Rare Tea Company then supplies Tea in the location Not Specified to a Restaurant named The Chiltern Firehouse.'
 'A Supplier named Cobble Lane Cured supplies High-end British Charcuterie in the location London to a Restaurant named Company of Cooks.'
 'A T2_Supplier named Amba supplies Handcrafted Black Teas, Lemongrass, Butalso Fruits & Vegetables, Spices, Honey and Homemade Jams in the location Uva Highlands, Sri Lanka to a Supplier named Rare Tea Company, this Supplier named Rare Tea Company then supplies Tea in the location Not Specified to a Restaurant named The Chiltern Firehouse.'
 'A Supplier named Hg Walter supplies British Meat in the location London to a Restaurant named River Café.'
 'A Supplier named The Cheese Shop supplies Cheese in the location Flying Horse Walk, Nottingham to a Restaurant named Restaurant Sat Bains.'
 'A Supplier named Fishermen of Brixham supplies Seafood in the location Brixham Market to a Restaurant named The Hawksmoor.'
 'A T2_Supplier named Satemwa Tea & Coffee Estate supplies Tea in the location Shire Highlands, Thyolo Mountains, Malawi to a Supplier named Rare Tea Company, this Supplier named Rare Tea Company then supplies Tea in the location Not Specified to a Restaurant named The Chiltern Firehouse.'
 'A Supplier named Flying Fish supplies Fish and Shellfish in the location Uk to a Restaurant named Muse.'
 'A Supplier named Lake District Farmers supplies Breed Specific Meat in the location Cumbria to a Restaurant named Muse.'
 'A T2_Supplier named Jun Chiyabari supplies Tea in the location Dhankuta, Eastern Nepal to a Supplier named Rare Tea Company.'
 'A T2_Supplier named Jun Chiyabari supplies Tea in the location Dhankuta, Eastern Nepal to a Supplier named Rare Tea Company, this Supplier named Rare Tea Company then supplies Tea in the location Not Specified to a Restaurant named St. John.'
 'A T2_Supplier named Jun Chiyabari supplies Tea in the location Dhankuta, Eastern Nepal to a Supplier named Rare Tea Company, this Supplier named Rare Tea Company then supplies Tea in the location Not Specified to a Restaurant named La Dame De Pic.'
 'A T2_Supplier named Satemwa Tea & Coffee Estate supplies Tea in the location Shire Highlands, Thyolo Mountains, Malawi to a Supplier named Rare Tea Company.'
 'A T2_Supplier named Jun Chiyabari supplies Tea in the location Dhankuta, Eastern Nepal to a Supplier named Rare Tea Company, this Supplier named Rare Tea Company then supplies Tea in the location Not Specified to a Restaurant named Coombehead Farm.'
 'A T2_Supplier named Jun Chiyabari supplies Tea in the location Dhankuta, Eastern Nepal to a Supplier named Rare Tea Company, this Supplier named Rare Tea Company then supplies Tea in the location Not Specified to a Restaurant named Belon.'
 'A T2_Supplier named Jun Chiyabari supplies Tea in the location Dhankuta, Eastern Nepal to a Supplier named Rare Tea Company, this Supplier named Rare Tea Company then supplies Tea in the location Not Specified to a Restaurant named Arcane.'
 'A T2_Supplier named Jun Chiyabari supplies Tea in the location Dhankuta, Eastern Nepal to a Supplier named Rare Tea Company, this Supplier named Rare Tea Company then supplies Tea in the location Not Specified to a Restaurant named Core by Clare Smyth.'
 'A T2_Supplier named Jun Chiyabari supplies Tea in the location Dhankuta, Eastern Nepal to a Supplier named Rare Tea Company, this Supplier named Rare Tea Company then supplies Tea in the location Not Specified to a Restaurant named The Clove Club.'
 'A T2_Supplier named Jun Chiyabari supplies Tea in the location Dhankuta, Eastern Nepal to a Supplier named Rare Tea Company, this Supplier named Rare Tea Company then supplies Tea in the location Not Specified to a Restaurant named Benu.']","[""The tier 2 suppliers of 'The Chiltern Firehouse' are Jun Chiyabari, Satemwa Tea & Coffee Estate, and Amba.""]",0.1249999999875,1.0,0.5,0.8167172761114232
What is the entire supply chain for the restaurant 'Notto'?,"{'Tier 1 Suppliers': 'H G Walter, Cibo, Wellocks at Home, The Wild Room', 'Tier 2 Suppliers': {'H G Walter': '', 'Cibo': '', 'Wellocks at Home': 'Truefoods, Wildfarmed, Eduardo Sousa, Westlands, Seddon Leeks, Belazu, The Food Heroes Family, Molyneux Kale Company, Blackthorn Salt, La Rose Noire', 'The Wild Room': ''}}","['A Supplier named H G Walter supplies Meat in the location Uk to a Restaurant named Notto.'
 'A Supplier named Cibo supplies 00 Flour, Burrata and Other Italian Ingredients in the location Not Specified to a Restaurant named Notto.'
 'A Supplier named Wellocks at Home supplies Larder Ingredients in the location Yorkshire to a Restaurant named Notto.'
 'A Supplier named The Wild Room supplies Wild Mushrooms and Foraged Produce in the location Not Specified to a Restaurant named Notto.'
 'A T2_Supplier named Belazu supplies Various Products in the location Not Specified to a Supplier named Wellocks at Home, this Supplier named Wellocks at Home then supplies Larder Ingredients in the location Yorkshire to a Restaurant named Notto.'
 'A T2_Supplier named Sushisushi supplies Sushi Ingredients in the location Not Specified to a Supplier named Wellocks at Home, this Supplier named Wellocks at Home then supplies Larder Ingredients in the location Yorkshire to a Restaurant named Notto.'
 'A T2_Supplier named La Rose Noire supplies Not Specified in the location Not Specified to a Supplier named Wellocks at Home, this Supplier named Wellocks at Home then supplies Larder Ingredients in the location Yorkshire to a Restaurant named Notto.'
 'A T2_Supplier named Eduardo Sousa supplies Not Specified in the location Not Specified to a Supplier named Wellocks at Home, this Supplier named Wellocks at Home then supplies Larder Ingredients in the location Yorkshire to a Restaurant named Notto.'
 'A Supplier named Natoora supplies Produce in the location Not Specified to a Restaurant named Warehouse.'
 'A T2_Supplier named Original Beans supplies Chocolate in the location Not Specified to a Supplier named Natoora.'
 'A T2_Supplier named Wildfarmed supplies Various Products in the location Not Specified to a Supplier named Wellocks at Home.'
 'A Supplier named The Wild Room supplies Wild Mushrooms, Fresh Truffles, Foraged Ingredients in the location Uk to a Restaurant named Warehouse.'
 'A Supplier named The Wild Room supplies Not Specified in the location Not Specified to a Restaurant named Company of Cooks.'
 'A T2_Supplier named Wildfarmed supplies Various Products in the location Not Specified to a Supplier named Wellocks at Home, this Supplier named Wellocks at Home then supplies Next Day Groceries in the location Not Specified to a Restaurant named Moor Hall.'
 'A T2_Supplier named Wild Greens Farm supplies Greens in the location Not Specified to a Supplier named Wellocks at Home.'
 'A T2_Supplier named Fresh Direct supplies Full Range of Fresh Produce in the location Not Specified to a Supplier named Wild Harvest.'
 'A T2_Supplier named Wildfarmed supplies Various Products in the location Not Specified to a Supplier named Wellocks at Home, this Supplier named Wellocks at Home then supplies Larder Ingredients in the location Yorkshire to a Restaurant named Notto.'
 'A T2_Supplier named Spilmans Asparagus supplies Asparagus in the location Not Specified to a Supplier named Wellocks at Home.'
 'A T2_Supplier named The Food Heroes Family supplies Various Products in the location Not Specified to a Supplier named Wellocks at Home.'
 'A T2_Supplier named Eduardo Sousa supplies Not Specified in the location Not Specified to a Supplier named Wellocks at Home.']","[""The restaurant 'Notto' has its supply chain primarily from one Tier 1 supplier, 'Wellocks at Home'. The Tier 2 suppliers, who supply to 'Wellocks at Home', include 'Amela Tomatoes', 'Belazu', 'Blackthorn Salt', 'Eduardo Sousa', 'La Rose Noire', 'Minus 8 Vinegar', 'Manjares Truffles', 'Molyneux Kale Company', 'Spilmans Asparagus', 'Sushisushi', 'Seddon Leeks', 'The Food Heroes Family', 'Tomlinson Farm Shop', 'Truefoods', 'Westlands', 'Wildfarmed', and 'Wild Greens Farm'.""]",0.9308207197945564,0.5,0.4,0.7742594229027754
What are some common suppliers of 'Meat'?,"{'Tier 1 Suppliers': 'Wellocks at Home, Fresh Direct, The Seahorse, Hg Walter', 'Tier 2 Suppliers': {'Wellocks at Home': 'Truefoods, Wildfarmed, Eduardo Sousa, Westlands, Seddon Leeks, Belazu, The Food Heroes Family, Molyneux Kale Company, Blackthorn Salt, La Rose Noire', 'Fresh Direct': 'Hammond Produce, Agrosol, De Groot, Sun Salads, Chiquita, Driscolls, Barfoots, Len Wrights', 'The Seahorse': 'Brixham Seafish', 'Hg Walter': 'The provided information does not specify any T2_Suppliers that directly supply to Hg Walter.'}}","['A T2_Supplier named Eduardo Sousa supplies Not Specified in the location Not Specified to a Supplier named Wellocks at Home.'
 'A T2_Supplier named Agrosol supplies Various Fruits and Vegetables in the location Almería, Spain to a Supplier named Fresh Direct.'
 'A T2_Supplier named Belazu supplies Various Products in the location Not Specified to a Supplier named Wellocks at Home.'
 'A T2_Supplier named Belazu supplies Various Products in the location Not Specified to a Supplier named Wellocks at Home, this Supplier named Wellocks at Home then supplies Next Day Groceries in the location Not Specified to a Restaurant named Moor Hall.'
 'A T2_Supplier named Hammond Produce supplies Various Vegetables in the location Uk to a Supplier named Fresh Direct.'
 'A T2_Supplier named Spilmans Asparagus supplies Asparagus in the location Not Specified to a Supplier named Wellocks at Home.'
 'A T2_Supplier named The Food Heroes Family supplies Various Products in the location Not Specified to a Supplier named Wellocks at Home.'
 'A T2_Supplier named Driscolls supplies Berries, Cherries, and Plums in the location Uk to a Supplier named Fresh Direct.'
 'A T2_Supplier named Brixham Seafish supplies Fish in the location Brixham to a Supplier named The Seahorse.'
 'A Supplier named Hg Walter supplies Meat and Pantry Products in the location London to a Restaurant named Kricket.'
 'A Supplier named Hg Walter supplies Not Specified in the location Not Specified to a Restaurant named Company of Cooks.'
 'A Supplier named Hg Walter supplies British Meat in the location London to a Restaurant named Petersham Nurseries.'
 'A Supplier named Hg Walter supplies Meat and Pantry Products in the location London to a Restaurant named Kricket.'
 'A Supplier named Hg Walter supplies Meat in the location London to a Restaurant named Andrew Edmunds.'
 'A Supplier named Hg Walter supplies Butchers in the location London to a Restaurant named Andrew Edmunds.'
 'A Supplier named Hg Walter supplies British Meat in the location London to a Restaurant named River Café.'
 'A Supplier named Hg Walter supplies Meat in the location London to a Restaurant named Cafe Murano.'
 'A Supplier named Hg Walter supplies Meat in the location London to a Restaurant named Farang.'
 'A Supplier named Hg Walter supplies British Meat in the location London to a Restaurant named Muse.'
 'A T2_Supplier named Eduardo Sousa supplies Not Specified in the location Not Specified to a Supplier named Wellocks at Home.']","[""Some common suppliers of 'Meat' are Aubrey Allen, H G Walter, and Lake District Farmers.""]",0.28492077667418114,0.0,0.5714285714285714,0.7828408944242811
Which suppliers of 'Meat' are based in 'London'?,"{'Tier 1 Suppliers': 'Wellocks at Home, Fresh Direct, The Seahorse, Hg Walter', 'Tier 2 Suppliers': {'Wellocks at Home': 'Truefoods, Wildfarmed, Eduardo Sousa, Westlands, Belazu, Seddon Leeks, The Food Heroes Family, Molyneux Kale Company, Blackthorn Salt, La Rose Noire', 'Fresh Direct': 'Hammond Produce, Agrosol, De Groot, Sun Salads, Chiquita, Driscolls, Barfoots, Len Wrights', 'The Seahorse': 'Brixham Seafish', 'Hg Walter': 'The information provided does not list any T2_Suppliers directly supplying Hg Walter.'}}","['A T2_Supplier named Eduardo Sousa supplies Not Specified in the location Not Specified to a Supplier named Wellocks at Home.'
 'A T2_Supplier named Agrosol supplies Various Fruits and Vegetables in the location Almería, Spain to a Supplier named Fresh Direct.'
 'A T2_Supplier named Belazu supplies Various Products in the location Not Specified to a Supplier named Wellocks at Home.'
 'A T2_Supplier named Belazu supplies Various Products in the location Not Specified to a Supplier named Wellocks at Home, this Supplier named Wellocks at Home then supplies Next Day Groceries in the location Not Specified to a Restaurant named Moor Hall.'
 'A T2_Supplier named Hammond Produce supplies Various Vegetables in the location Uk to a Supplier named Fresh Direct.'
 'A T2_Supplier named Spilmans Asparagus supplies Asparagus in the location Not Specified to a Supplier named Wellocks at Home.'
 'A T2_Supplier named The Food Heroes Family supplies Various Products in the location Not Specified to a Supplier named Wellocks at Home.'
 'A T2_Supplier named Driscolls supplies Berries, Cherries, and Plums in the location Uk to a Supplier named Fresh Direct.'
 'A T2_Supplier named Brixham Seafish supplies Fish in the location Brixham to a Supplier named The Seahorse.'
 'A Supplier named Hg Walter supplies Meat and Pantry Products in the location London to a Restaurant named Kricket.'
 'A Supplier named Hg Walter supplies Not Specified in the location Not Specified to a Restaurant named Company of Cooks.'
 'A Supplier named Hg Walter supplies British Meat in the location London to a Restaurant named Petersham Nurseries.'
 'A Supplier named Hg Walter supplies Meat and Pantry Products in the location London to a Restaurant named Kricket.'
 'A Supplier named Hg Walter supplies Meat in the location London to a Restaurant named Andrew Edmunds.'
 'A Supplier named Hg Walter supplies Butchers in the location London to a Restaurant named Andrew Edmunds.'
 'A Supplier named Hg Walter supplies British Meat in the location London to a Restaurant named River Café.'
 'A Supplier named Hg Walter supplies Meat in the location London to a Restaurant named Cafe Murano.'
 'A Supplier named Hg Walter supplies Meat in the location London to a Restaurant named Farang.'
 'A Supplier named Hg Walter supplies British Meat in the location London to a Restaurant named Muse.'
 'A T2_Supplier named Eduardo Sousa supplies Not Specified in the location Not Specified to a Supplier named Wellocks at Home.']","[""The supplier of 'Meat' based in 'London' is 'Hg Walter'.""]",0.3134863197005868,1.0,0.3333333333333333,0.8022217349608431
